### ISSUE TITLE
Upgraded to 2.3.14 and dialin users get cut off after approximately 1 minute

### ISSUE THREAD

**Issue by caniwi** [bigbluebutton/bigbluebutton#13274]
**Describe the bug**
Upgraded to the latest 2.3 release this morning and anyone dialling into a meeting using a mobile or landline gets cut off after approximately 1 minute

**To Reproduce**
1. Start a meeting
2. Have someone dial into the meeting
3. They get cut off after approximately 1 minute

**Expected behavior**
The dial in user should be able to stay in the meeting.

**Actual behavior**
The dialin user gets cut off.

**Screenshots**

**Desktop (please complete the following information):**
 - OS: Linux 20.04
 - Browser Firefox 
 - Version 92.0

**Smartphone (please complete the following information):**
 - Device: Oneplus
 - OS: Oxygen
 - Browser N/A
 - Version N/A

**Additional context**
User follows dialin prompts gets connected to the meeting fine but gets cutoff.  User can dialin again and gets same behaviour.
dthompson@cat-porwal-uat-bbb2:~$ sudo bbb-conf --version

BigBlueButton Server 2.3.14 (2458)

ii  bbb-apps-akka                               2.3.0-103                                 all          BigBlueButton Apps (Akka)
ii  bbb-config                                  1:2.3.0-94                                amd64        BigBlueButton configuration utilities
ii  bbb-etherpad                                1:2.3.0-51                                amd64        The EtherPad Lite components for BigBlueButton
ii  bbb-freeswitch-core                         2:2.3.0-27                                amd64        BigBlueButton build of FreeSWITCH
ii  bbb-freeswitch-sounds                       1:1.6.7-3                                 amd64        FreeSWITCH Sounds
ii  bbb-fsesl-akka                              2.3.0-55                                  all          BigBlueButton FS-ESL (Akka)
ii  bbb-html5                                   1:2.3.0-1845                              amd64        The HTML5 components for BigBlueButton
ii  bbb-libreoffice-docker                      1:2.3.0-56                                amd64        BigBlueButton setup for LibreOffice running in docker
ii  bbb-mkclean                                 1:0.8.7-4                                 amd64        Clean and optimize Matroska and WebM files
ii  bbb-playback                                1:2.3.0-20                                amd64        BigBlueButton playback
ii  bbb-playback-presentation                   1:2.3.0-13                                amd64        BigBluebutton playback of presentation
ii  bbb-record-core                             1:2.3.0-37                                amd64        BigBlueButton record and playback
rc  bbb-transcode-akka                          2.3.0-1                                   all          BigBlueButton Transcoder
ii  bbb-web                                     1:2.3.0-95                                amd64        BigBlueButton API
ii  bbb-webrtc-sfu                              1:2.3.0-36                                amd64        BigBlueButton WebRTC SFU
ii  bigbluebutton                               1:2.3.0-7                                 amd64        Open source web conferencing platform (bbb)
ii  ffmpeg                                      7:4.2.4-1ubuntu0.1bbb2~18.04              amd64        Tools for transcoding, streaming and playing of multimedia files
ii  libavcodec58:amd64                          7:4.2.4-1ubuntu0.1bbb2~18.04              amd64        FFmpeg library with de/encoders for audio/video codecs - runtime files
ii  libavdevice58:amd64                         7:4.2.4-1ubuntu0.1bbb2~18.04              amd64        FFmpeg library for handling input and output devices - runtime files
ii  libavfilter7:amd64                          7:4.2.4-1ubuntu0.1bbb2~18.04              amd64        FFmpeg library containing media filters - runtime files
ii  libavformat58:amd64                         7:4.2.4-1ubuntu0.1bbb2~18.04              amd64        FFmpeg library with (de)muxers for multimedia containers - runtime files
ii  libavresample4:amd64                        7:4.2.4-1ubuntu0.1bbb2~18.04              amd64        FFmpeg compatibility library for resampling - runtime files
ii  libavutil56:amd64                           7:4.2.4-1ubuntu0.1bbb2~18.04              amd64        FFmpeg library with functions for simplifying programming - runtime files
ii  libopusenc0                                 0.2.1-1bbb1                               amd64        High-level API for encoding Ogg Opus audio streams
ii  libpostproc55:amd64                         7:4.2.4-1ubuntu0.1bbb2~18.04              amd64        FFmpeg library for post processing - runtime files
ii  libswresample3:amd64                        7:4.2.4-1ubuntu0.1bbb2~18.04              amd64        FFmpeg library for audio resampling, rematrixing etc. - runtime files
ii  libswscale5:amd64                           7:4.2.4-1ubuntu0.1bbb2~18.04              amd64        FFmpeg library for image scaling and various conversions - runtime files

**Comment by hostbbb** [comment]
did this work on 2.2.13, what version did you upgrade from?

Also, need to see if freeswitch is dropping the call,  or BBB is sending command to kick.    2.2.14 has fix for IOS and new freeswitch.   look in /opt/freeswitch /log,  and also the bigbluebutton bbb_web and fs_akka logs to see.

Also if you updated from older 2.2.x  you could try 2.2.13 to eliminate the new freeswitch in 2.14 as good test.

**Comment by mariogasparoni** [comment]
Hi @caniwi , thanks for the report.

I could not reproduce this issue. Could you paste some FreeSWITCH logs ?

**Comment by krim404** [comment]
i was able to replicate this issue, so it is valid

**Comment by PhMemmel** [comment]
I have the same problem. I could reproduce it once(!). Since this one time it's now working without any problems. Unfortunately I can't figure out any logs related to that. I even hit `bbb-conf --restart` but it kept working. I am using 2.4-rc1.

Additional info: The time it broke I still could hear the sound of the conference in my phone, but couldn't talk anymore. User also isn't shown as "muted" or sth like that.

**Comment by hostbbb** [comment]
question on the failures.   are you using sip_registration to your provider where freeswitch has credentials to register to the telco switch.  Or are you using simple IP forwarding and just looking for incoming on 5060 UDP from IP address.

**Comment by PhMemmel** [comment]
I'm using sipgate.de, I'm authenticating with credentials provided by them.

**Comment by hostbbb** [comment]
I have 2.4rc1 using IP Auth,  not able to fail a call... seems to work  if you can dial a us number,  try to break it, i have all logging  https://dev24.distancelearning.cloud     It also has a raisehand feature where you press 9 to raise lower hand in meeting.

Be interested with sip.de if you see any failures re-registering in freeswitch logs,  or using >sofia status

i will try with rc2 with new freeswitch is released as well.

**Comment by caniwi** [comment]
> did this work on 2.2.13, what version did you upgrade from?
> 
> Also, need to see if freeswitch is dropping the call, or BBB is sending command to kick. 2.2.14 has fix for IOS and new freeswitch. look in /opt/freeswitch /log, and also the bigbluebutton bbb_web and fs_akka logs to see.
> 
> Also if you updated from older 2.2.x you could try 2.2.13 to eliminate the new freeswitch in 2.14 as good test.

yes it did work on 2.2.13.

**Comment by caniwi** [comment]
Here are some log extracts.  The issue is still happening.  Both land lines and mobile connections

[bbb-fsesl-akka.log](https://github.com/bigbluebutton/bigbluebutton/files/7232267/bbb-fsesl-akka.log)
[bbb-web.log](https://github.com/bigbluebutton/bigbluebutton/files/7232268/bbb-web.log)
[freeswitch.log](https://github.com/bigbluebutton/bigbluebutton/files/7232269/freeswitch.log)
.

**Comment by caniwi** [comment]
This is the update where the dial facility broke.

Start-Date: 2021-09-23  12:08:42
Commandline: apt full-upgrade
Requested-By: dthompson (10247)
Upgrade: snapd:amd64 (2.49.2+18.04, 2.51.1+18.04), bbb-html5:amd64 (1:2.3.0-1842, 1:2.3.0-1845), bbb-web:amd64 (1:2.3.0-94, 1:2.3.0-95), bbb-playback:amd64 (1:2.3.0-18, 1:2.3.0-20), bbb-freeswitch-core:amd64 (2:2.3.0-24, 2:2.3.0-27), bbb-apps-akka:amd64 (2.3.0-102, 2.3.0-103), bbb-config:amd64 (1:2.3.0-93, 1:2.3.0-94), bbb-webrtc-sfu:amd64 (1:2.3.0-34, 1:2.3.0-36)
End-Date: 2021-09-23  12:12:31

**Comment by caniwi** [comment]
I did a tcpdump on the bigbluebutton server.  It looks to me like bigbluebutton is saying goodbye.

tcpdump -i ens3 host 202.78.241.89
tcpdump: verbose output suppressed, use -v or -vv for full protocol decode
listening on ens3, link-type EN10MB (Ethernet), capture size 262144 bytes
17:37:32.852604 IP pabx.catalyst.net.nz.sip > cat-porwal-uat-bbb2.servers.catalyst.net.nz.sip: SIP: INVITE sip:gw+cat-porwal-prod-pabx1@10.15.8.128:5060;transport=udp;gw=cat-porwal-prod-pabx1 SIP/2.0
17:37:32.855300 IP cat-porwal-uat-bbb2.servers.catalyst.net.nz.sip > pabx.catalyst.net.nz.sip: SIP: SIP/2.0 100 Trying
17:37:32.860434 IP cat-porwal-uat-bbb2.servers.catalyst.net.nz.sip > pabx.catalyst.net.nz.sip: SIP: SIP/2.0 200 OK
17:37:33.360191 IP cat-porwal-uat-bbb2.servers.catalyst.net.nz.sip > pabx.catalyst.net.nz.sip: SIP: SIP/2.0 200 OK
17:37:34.360909 IP cat-porwal-uat-bbb2.servers.catalyst.net.nz.sip > pabx.catalyst.net.nz.sip: SIP: SIP/2.0 200 OK
17:37:36.361958 IP cat-porwal-uat-bbb2.servers.catalyst.net.nz.sip > pabx.catalyst.net.nz.sip: SIP: SIP/2.0 200 OK
17:37:36.877706 IP cat-porwal-uat-bbb2.servers.catalyst.net.nz.20705 > pabx.catalyst.net.nz.16509: UDP, length 112
17:37:40.362244 IP cat-porwal-uat-bbb2.servers.catalyst.net.nz.sip > pabx.catalyst.net.nz.sip: SIP: SIP/2.0 200 OK
17:37:40.897697 IP cat-porwal-uat-bbb2.servers.catalyst.net.nz.20705 > pabx.catalyst.net.nz.16509: UDP, length 112
17:37:44.362656 IP cat-porwal-uat-bbb2.servers.catalyst.net.nz.sip > pabx.catalyst.net.nz.sip: SIP: SIP/2.0 200 OK
17:37:44.917689 IP cat-porwal-uat-bbb2.servers.catalyst.net.nz.20705 > pabx.catalyst.net.nz.16509: UDP, length 112
17:37:48.363680 IP cat-porwal-uat-bbb2.servers.catalyst.net.nz.sip > pabx.catalyst.net.nz.sip: SIP: SIP/2.0 200 OK
17:37:48.937655 IP cat-porwal-uat-bbb2.servers.catalyst.net.nz.20705 > pabx.catalyst.net.nz.16509: UDP, length 112
17:37:52.363915 IP cat-porwal-uat-bbb2.servers.catalyst.net.nz.sip > pabx.catalyst.net.nz.sip: SIP: SIP/2.0 200 OK
17:37:53.957673 IP cat-porwal-uat-bbb2.servers.catalyst.net.nz.20705 > pabx.catalyst.net.nz.16509: UDP, length 112
17:37:56.364133 IP cat-porwal-uat-bbb2.servers.catalyst.net.nz.sip > pabx.catalyst.net.nz.sip: SIP: SIP/2.0 200 OK
17:37:58.977676 IP cat-porwal-uat-bbb2.servers.catalyst.net.nz.20705 > pabx.catalyst.net.nz.16509: UDP, length 112
17:38:00.364380 IP cat-porwal-uat-bbb2.servers.catalyst.net.nz.sip > pabx.catalyst.net.nz.sip: SIP: SIP/2.0 200 OK
17:38:03.997670 IP cat-porwal-uat-bbb2.servers.catalyst.net.nz.20705 > pabx.catalyst.net.nz.16509: UDP, length 112
17:38:04.364521 IP cat-porwal-uat-bbb2.servers.catalyst.net.nz.sip > pabx.catalyst.net.nz.sip: SIP: SIP/2.0 200 OK
17:38:04.860836 IP cat-porwal-uat-bbb2.servers.catalyst.net.nz.sip > pabx.catalyst.net.nz.sip: SIP: BYE sip:1093761731@202.78.241.89:5060 SIP/2.0
17:38:04.862736 IP pabx.catalyst.net.nz.sip > cat-porwal-uat-bbb2.servers.catalyst.net.nz.sip: SIP: SIP/2.0 200 OK

**Comment by caniwi** [comment]
So performing packet tracing on both ends we dicscovered that Big Blue Button, after the voice call connected was sending it's INTERNAL IP back to the pabx server rather than the public IP.    A bit of research of config files found /opt/freeswitch/etc/freeswitch/autoload_configs/verto.conf.xml had the following line:

      

changing it to 
     <param name="ext-rtp-ip" value="bbb external ip"/>

and a bbb-conf --restart and all was well again.

**Comment by mariogasparoni** [comment]
We don't really  change mod_verto settings in our default setup for dial users, but dialplans and profiles.

Anyways , ext-rtp-ip needs to be set when FREESWITCH is behind NAT , and this is documented here: https://docs.bigbluebutton.org/admin/configure-firewall.html#update-freeswitch

I am glad this is working for you now , but it seems FreeSWITCH's update override some your custom setup. 

Could you please close this issue now ?

**Comment by caniwi** [comment]
Well we did have all the changes as described in the documentation you reference. I checked it a number of times.

To get it to work I had to find the /opt/freeswitch/etc/freeswitch/autoload_configs/verto.conf.xml file and modify it.  This file is not mentioned in the docs, so it could be a documentation issue.

**Comment by mariogasparoni** [comment]
Yes, verto's documentation is uncovered in BBB docs.
FreeSWITCH has lots of nice modules , and most of them already have it's own documentation. So if you are trying to use something more specific, you may need to dig into FreeSWITCH docs.

**Comment by hostbbb** [comment]
So this is a new 2.3.14

 

Mod_verto is not needed for BBB,  the file below is where mod_verto would be loaded I believe… @mariogsp <-- can confirm

 

So if you made a change to mod_verto conf…   sounds like your modules.conf.xml may be loading mod_verto on start?  

 

Look here to make sure modules.conf.xml is not an older version left from upgrading.  In 2.2 we had the default files which included all the default modules.

 

 

***@***.***:/opt/freeswitch/conf/autoload_configs# cat modules.conf.xml

<configuration name="modules.conf" description="Modules">

  <modules>

    

    <load module="mod_console"/>

    <load module="mod_logfile"/>

 

    

    <load module="mod_event_socket"/>

 

    

    <load module="mod_sofia"/>

 

    

    <load module="mod_commands"/>

    <load module="mod_conference"/>

    <load module="mod_dptools"/>

 

    

    <load module="mod_dialplan_xml"/>

 

    

    <load module="mod_opus"/>

    <load module="mod_opusfile"/>

 

    

    <load module="mod_sndfile"/>

    <load module="mod_native_file"/>

 

  </modules>

</configuration>

 

 

Regards,

Stephen

**Comment by caniwi** [comment]
This has started working.  Our 2.3 is fine now.
